"ID";"Enabled";"Category";"Name";"Price";"Tax rule ID";"Quantity";"Long desc";"Images URL"
258;1;4;Nowoczesna lampa sufitowa czarna żyrandol do garderoby 3x GU10 + 3x żarówka LED GU10 3W;224.99;1;10;	Lampa sufitowa z trzema czarnymi oprawkami, w których można zamontować żarówki LED o trzonku GU10 to produkt wysokiej jakości ze źródłem światła LED w komplecie. Żyrandol został stworzony po to, aby pięknie oświetlić garderobę, choć równie dobrze sprawdzi się zamontowany np. na korytarzu. Dołączone do kompletu żarówki LED o mocy 3W i białej ciepłej barwie światła wprowadzą przyjemną atmosferę i oświetlą pięknym, optymistycznym światłem ciemny korytarz czy garderobę. Nowoczesny design lampy, zaprojektowany w zgodzie z najnowszymi trendami, to praktyczny i niebanalny dodatek, który będzie w stanie ożywić i odmienić wnętrze.	Jeśli poszukujesz dobrej jakościowo lampy sufitowej, która przy okazji ładnie się prezentuje to lampa przedstawiona tutaj będzie dobrym wyborem. Dodatkowo żyrandol posiada dołączone źródła światła, co jest jego ogromną zaletą.	Produkt wykonany został z wysokiej jakości materiałów, zapewniających jego długotrwałą żywotność i satysfakcję z zakupu. Kupując u nas otrzymujesz nowy, oryginalnie zapakowany produkt, objęty 2-letnią gwarancją producenta. Tylko zakup markowych produktów gwarantuje wysoką jakość, energooszczędność, bezpieczeństwo użytkowania oraz pewność, że informacje umieszczone na opakowaniach będą zgodne z prawdą.;https://leddo.pl/media/catalog/product/cache/07dd3f8478790f89e7d25033ddff57ef/l/a/lampa-sufitowa-czarna-nowoczesna-plafon-3x-gu10-001.jpg
259;1;4;Lampa dziecięca sufitowa fioletowa Żyrandol Serduszka CORAZON 3x E27 Metal i kryształki Milagro;323.00;1;10;Lampa dziecięca z kolekcji CORAZON to uroczy żyrandol, w fioletowym kolorze, który zdobią fantazyjnie wiszące kryształki i serduszka. Fioletowa lampa współpracuje z trzema żarówkami E27, o mocy maksymalnej wynoszącej 60 W (brak w zestawie). Lampa sufitowa za sprawą swojego bajecznego wyglądu świetnie sprawdzi się w dziecięcym pokoju i pięknie go oświetli. Lampa dla dzieci za sprawą mieniących się kryształków wywoła uśmiech na twarzy każdego dziecka. Lampa z serduszkami, w fioletowym kolorze, wprowadzi w każdym wnętrzu radosną i przyjemną atmosferę. Lampy CORAZON od firmy MiLAGRO objęte są gwarancją producenta, mają certyfikaty zgodności, a także instrukcję obsługi wraz z elementami niezbędnymi do ich złożenia.;https://leddo.pl/media/catalog/product/cache/07dd3f8478790f89e7d25033ddff57ef/m/l/mlp1149_10983_0_gfqvrmynjlu5vygv.jpg
260;1;4;Lampa wisząca sufitowa WEST czarna 3x GU10 MILAGRO geometryczna metal + drewno;522.00;1;10;Lampa sufitowa z linii produktów WEST BLACK to niezwykle nowoczesna lampa charakteryzująca się geometrycznym i wyrazistym kształtem. Lampa wisząca została wyprodukowana przez polską markę MiLAGRO. Jej trzy czarne i podłużne klosze przyciągają uwagę, a drewniany element doskonale z nimi współgra. Lampa łączy w sobie nowoczesny design ze skandynawskim stylem i przywiązaniem do natury. Czarna lampa będzie stanowić idealne uzupełnienie wnętrz utrzymanych w minimalistycznym, skandynawskim bądź nowoczesnym stylu. Lampa współpracuje z pięcioma żarówkami o trzonku GU10, o mocy maksymalnej 8W.MiLAGRO to marka, która produkuje swoje lampy m.in. na własnej linii produkcyjnej, w Polsce, przy użyciu specjalistycznych maszyn. Kupując lampy tej firmy wspierasz polskie marki, przedsiębiorców i projektantów. Produkty wyprodukowane przez firmę MiLAGRO objęto 2-letnim okresem gwarancji. Po tym czasie można skorzystać ze specjalistycznego serwisu firmowego.;https://leddo.pl/media/catalog/product/cache/07dd3f8478790f89e7d25033ddff57ef/m/l/mlp5513_7504_0_rjcsbgbkwpggfamr.jpg
261;1;4;Lampa sufitowa Macao 4x G4 Metal i szkło Lampex Styl glamour Kryształki + Pilot;531.00;1;10;Lampa sufitowa Macao charakteryzuje się pięknym i eleganckim wyglądem, który idzie w parze z nowoczesną technologią. Lampa w stylu glamour  o niepowtarzalnym kształcie zdobiona jest kryształem oraz szklanymi bryłami, które doskonale podkreślą charakter nowoczesnych pomieszczeń. Elegancka lampa została wykonana z wysokiej jakości materiałów (szkła i metalu), dzięki czemu świetnie prezentuje się w nowoczesnych wnętrzach, działając niezawodnie przez długi czas. Lampa współpracuje z żarówkami G4, wraz z którymi stworzy w pomieszczeniu niepowtarzalną atmosferę. Lampa z kryształkami idealnie sprawdzi się na salach weselnych czy w restauracjach. Lampa w zestawie posiada pilot, który umożliwia włączenie różnych efektów świetlnych. Lampa z pilotem szczególnie polecana jest do designerskich i stylowych wnętrz. ;https://leddo.pl/media/catalog/product/cache/07dd3f8478790f89e7d25033ddff57ef/4/0/408_4408_4_sy2yhwf6hca11aco.jpg
262;1;4;Lampa sufitowa NODUM SKRĘT czarny do LED 3x E27 LUMILED ;82.00;1;10;Czy chcesz urozmaicić i zachwycać swoim wnętrzem? Poznaj 7 najważniejszych zalet LAMPY SUFITOWEJ!Lampa sufitowa NODUM marki LUMILED SKRĘT z trzema punktami świetlnymi w loftowym stylu charakteryzuje elegancki minimalizm idący w parze ze swobodą i artyzmem, zawieszona w centralnym miejscu będzie cieszącą oczy ozdobą, nadaje się także do przestrzeni komercyjnych, takich jak bar czy klimatyczna restauracja, jak również będzie doskonałym dodatkiem do nowoczesnych, bądź minimalistycznych wnętrz, doda im uroku i sprawi, że odmienią one swoje oblicze.kmTa lampa to produkt idealny dla każdego, kto pragnie udekorować swoje mieszkanie niepowtarzalnym i nieszablonowym dodatkiem, który będzie podkreślał oryginalny i awangardowy wystrój wnętrza.kmNiezwykle wygląda na tle jasnych ścian, lub w pomieszczeniu gdzie dominuje biel, ponieważ uwypukla to jej niezwykłą konstrukcję.POSTAW NA TĘ LAMPĘ SUFITOWĄ I OCZARUJ SWOICH GOŚCI!    *MATERIAŁ WYKONANIA*GWINT E27UWAGA! Brak źródła światła w komplecie. *KLOSZ   *ŁATWOŚĆ MONTAŻU*WYMIAR LAMPY   GDZIE MOŻESZ WYKORZYSTAĆ LAMPĘ? Kilka przykładów zastosowań!  INFORMACJA: Źródła światła można podpiąć na kilka włączników.Wygląd Twojego mieszkania będzie UNIKATOWY, dzięki TEJ lampie! Produkt wykonany został z wysokiej jakości materiałów, zapewniających jego długotrwałą żywotność i satysfakcję z zakupu. Kupując u nas, otrzymujesz nowy, oryginalnie zapakowany produkt, objęty 2-letnią gwarancją producenta. Tylko zakup markowych produktów gwarantuje wysoką jakość, energooszczędność, bezpieczeństwo użytkowania oraz pewność, że informacje umieszczone na opakowaniach będą zgodne z prawdą.;https://leddo.pl/media/catalog/product/cache/07dd3f8478790f89e7d25033ddff57ef/l/u/lumila0090_1_.jpg
263;1;4; Listwa LAMPA sufitowa LED Polux Ficudi 3x6W Kolor BIAŁY 3000K ;83.58;1;10;LISTWA SUFITOWA LED marki Polux z kolekcji Fucidi w kolorze białym z 3-ema źródłami światła. Lampa sufitowa świetnie sprawdzi się w różnych pomieszczeniach typu: kuchnia, łazienka, biuro/sklep. Dzięki możliwości ustawienia padania promieni światła pod dowolnym kątem, idealnie oświetlisz wybraną przez siebie przestrzeń. Ciesz się przyjemną dla oka, ciepłą barwą światła białego o mocy 3000K dzięki wbudowanym do oprawy diodom led. Nowoczesne i praktyczne oświetlenie w formie listwy led, może służyć w zależności od potrzeb, jako głowne lub dodatkowe źródło światła Odmień swoje wnętrze i korzystaj z wszystkich możliwości jakie daje Ci oświetlenie led najnowszej genereacji.  Mieszkaj modnie i stylowo. Zobacz inne dostępne u nas modele oświetleniowych listw led.SPECYFIKACJA TECHNICZNA:Produkt wykonany został z wysokiej jakości materiałów, zapewniających jego długotrwałą żywotność i satysfakcję z zakupu. Kupując u nas otrzymujesz nowy, oryginalnie zapakowany produkt, objęty 2-letnią gwarancją producenta. Tylko zakup markowych produktów gwarantuje wysoką jakość, energooszczędność, bezpieczeństwo użytkowania oraz pewność, że informacje umieszczone na opakowaniach będą zgodne z prawdą.;https://leddo.pl/media/catalog/product/cache/07dd3f8478790f89e7d25033ddff57ef/f/i/ficudi_3_bia_a_1_.jpg
264;1;4; Listwa LAMPA sufitowa LED Polux Ficudi 4x6W Kolor BIAŁY 3000K ;87.95;1;10;LISTWA SUFITOWA LED marki Polux z kolekcji Fucidi w kolorze białym z 4-ema źródłami światła. Lampa sufitowa świetnie sprawdzi się w różnych pomieszczeniach typu: kuchnia, łazienka, biuro/sklep urządzonych w stylu klasycznym i nowoczesnym. Dzięki możliwości ustawienia padania promieni światła pod dowolnym kątem, idealnie oświetlisz wybraną przez siebie przestrzeń. Ciesz się przyjemną dla oka, ciepłą barwą światła białego o mocy 3000K dzięki wbudowanym do oprawy diodom led. Nowoczesne i praktyczne oświetlenie w formie listwy led, może służyć w zależności od potrzeb, jako głowne lub dodatkowe źródło światła. Odmień swoje wnętrze i korzystaj z wszystkich możliwości jakie daje Ci oświetlenie led najnowszej genereacji.  Mieszkaj modnie i stylowo. Zobacz inne dostępne u nas modele oświetleniowych listw sufitowych led. SPECYFIKACJA TECHNICZNA:Produkt wykonany został z wysokiej jakości materiałów, zapewniających jego długotrwałą żywotność i satysfakcję z zakupu. Kupując u nas otrzymujesz nowy, oryginalnie zapakowany produkt, objęty 2-letnią gwarancją producenta. Tylko zakup markowych produktów gwarantuje wysoką jakość, energooszczędność, bezpieczeństwo użytkowania oraz pewność, że informacje umieszczone na opakowaniach będą zgodne z prawdą.;https://leddo.pl/media/catalog/product/cache/07dd3f8478790f89e7d25033ddff57ef/l/i/listwa_led_polux_ficudi_4x6w_biala.jpg
265;1;4;Lampa sufitowo-ścienna ruchoma regulowana 8,4W LED RAWI 2 czarny 3000K Polux;119.22;1;10;Czy chcesz urozmaicić i zachwycać swoim wnętrzem? Poznaj 13 najważniejszych zalet LAMPY sufitowo-ściennej!Lampa sufitowo-ścienna RAWI z dwoma punktami świetlnymi w nowoczesnym stylu o mocy 8,4W i strumieniu świetlnym 850lm, o ciepłej barwie światła, posiada szeroki kąt świecenia 120°. Jest w stanie oświetlić nawet najciemniejsze pomieszczenie i wprowadzić w nie przytulny, przyjemny i jasny klimat. Belka będzie cieszącą oczy ozdobą, nadaje się także do przestrzeni komercyjnych, takich jak bar czy klimatyczna restauracja, jak również będzie doskonałym dodatkiem do nowoczesnych, glamour bądź tradycyjnych wnętrz, doda im uroku i sprawi, że odmienią one swoje oblicze.km.Ta lampa to produkt idealny dla każdego, kto pragnie udekorować swoje mieszkanie niepowtarzalnym i nieszablonowym dodatkiem, który będzie podkreślał oryginalny i awangardowy wystrój wnętrza.km.Niezwykle wygląda na tle jasnych ścian, lub w pomieszczeniu gdzie dominuje biel, ponieważ uwypukla to jej niezwykłą konstrukcję.POSTAW NA TĘ LAMPĘ SUFITOWO-ŚCIENNĄ I OCZARUJ SWOICH GOŚCI!*MATERIAŁ WYKONANIA*ŁATWOŚĆ MONTAŻU*WYMIAR LAMPYGDZIE MOŻESZ WYKORZYSTAĆ LAMPĘ? Kilka przykładów zastosowań!  Wygląd Twojego mieszkania będzie UNIKATOWY, dzięki TEJ lampie! Produkt wykonany został z wysokiej jakości materiałów, zapewniających jego długotrwałą żywotność i satysfakcję z zakupu. Kupując u nas, otrzymujesz nowy, oryginalnie zapakowany produkt, objęty 2-letnią gwarancją producenta. Tylko zakup markowych produktów gwarantuje wysoką jakość, energooszczędność, bezpieczeństwo użytkowania oraz pewność, że informacje umieszczone na opakowaniach będą zgodne z prawdą.;https://leddo.pl/media/catalog/product/cache/07dd3f8478790f89e7d25033ddff57ef/5/9/5901508318350_rawi_2_black_1_.jpg
266;1;4;Lampa sufitowo-ścienna ruchoma regulowana 8,4W LED BERG 2 czarny 3000K Polux;120.12;1;10;Czy chcesz urozmaicić i zachwycać swoim wnętrzem? Poznaj 13 najważniejszych zalet LAMPY sufitowo-ściennej!Lampa sufitowo-ścienna z dwoma punktami świetlnymi w nowoczesnym stylu o mocy 8,4W i strumieniu świetlnym 850lm, o ciepłej barwie światła, posiada szeroki kąt świecenia 120°. Jest w stanie oświetlić nawet najciemniejsze pomieszczenie i wprowadzić w nie przytulny, przyjemny i jasny klimat. TUBA będzie cieszącą oczy ozdobą, nadaje się także do przestrzeni komercyjnych, takich jak bar czy klimatyczna restauracja, jak również będzie doskonałym dodatkiem do nowoczesnych, glamour bądź tradycyjnych wnętrz, doda im uroku i sprawi, że odmienią one swoje oblicze.km.Ta lampa to produkt idealny dla każdego, kto pragnie udekorować swoje mieszkanie niepowtarzalnym i nieszablonowym dodatkiem, który będzie podkreślał oryginalny i awangardowy wystrój wnętrza.km.Niezwykle wygląda na tle jasnych ścian, lub w pomieszczeniu gdzie dominuje biel, ponieważ uwypukla to jej niezwykłą konstrukcję.POSTAW NA TĘ LAMPĘ WISZĄCĄ I OCZARUJ SWOICH GOŚCI!   *MATERIAŁ WYKONANIA*ŁATWOŚĆ MONTAŻU*WYMIAR LAMPY GDZIE MOŻESZ WYKORZYSTAĆ LAMPĘ? Kilka przykładów zastosowań!  Wygląd Twojego mieszkania będzie UNIKATOWY, dzięki TEJ lampie! Produkt wykonany został z wysokiej jakości materiałów, zapewniających jego długotrwałą żywotność i satysfakcję z zakupu. Kupując u nas, otrzymujesz nowy, oryginalnie zapakowany produkt, objęty 2-letnią gwarancją producenta. Tylko zakup markowych produktów gwarantuje wysoką jakość, energooszczędność, bezpieczeństwo użytkowania oraz pewność, że informacje umieszczone na opakowaniach będą zgodne z prawdą.;https://leddo.pl/media/catalog/product/cache/07dd3f8478790f89e7d25033ddff57ef/5/9/5901508318169_1_kopia.jpg
267;1;4;Lampa sufitowa żyrandol Carlos 3 3x E27 Metal Lampex loft retro edison;137.00;1;10;Lampa sufitowa z serii Carlos, to wspaniała lampa, która z pewnością zachwyci miłośników stylu loft oraz retro. Żyrandol posiada finezyjnie pozawijany metalowy korpus, który będzie się wspaniale prezentować na suficie i stanie się designerską ozdobą dopełniająca wystrój wnętrza. Lampa loft wykonana z najwyższej jakości metalu pozwoli cieszyć się trwałością oraz niezawodnością przez wiele lat. Lampa Edison polecana jest przede wszystkim do salonu, jadalni, sypialni, kuchni oraz korytarza. Lampa współpracuje z żarówkami o trzonku E27 o mocy maksymalnej 60W (brak w zestawie).;https://leddo.pl/media/catalog/product/cache/07dd3f8478790f89e7d25033ddff57ef/8/1/816_3816_3_rtva1bht0espvbuj.jpg
268;1;4;Lampa sufitowa Viola 2B czarna liście 2xE27 Metal i szkło styl klasyczny retro  Lampex;148.01;1;10;Lampa sufitowa Viola to doskonała propozycja dla miłośników stylu klasycznego. Solidnie wykonana metalowa podstawa została dodatkowo ozdobiona dekoracyjnymi listkami, dzięki czemu przyciąga spojrzenia. Lampa została wykonana z materiałów najwyższej jakości,dzięki czemu wygląda wspaniale, jednocześnie zachowując walory niezawodności.  Lampa sufitowa współgra z żarówkami o trzonku E27 oraz mocy max 60W (brak w zestawie).;https://leddo.pl/media/catalog/product/cache/07dd3f8478790f89e7d25033ddff57ef/6/4/648_2b-cza648_2b-cza_coo4okpk00ybbj7j.jpg
269;1;4;Lampa sufitowa tuba NOWODVORSKI GU10 Czarna Ruchomy Klosz EYE SUPER 6503 Stal 77 cm;149.00;1;10;Lampa sufitowa EYE SUPER 6503 to szykowna i minimalistyczna propozycja od firmy Nowodvorski. Gwint GU10 został zamknięty w stalowym kloszu i wbudowany w oprawę w kształcie metalowej tuby, o uniwersalnym czarnym kolorze i niewielkiej średnicy. Stonowana barwa, w połączeniu z delikatnie odbijającym światło wykończeniem, sprosta oczekiwaniom najbardziej wymagających klientów. Jej obudowa została zawieszona na  sztywnym zawiesiu, dodatkowo możemy manipulować źródłem światła, Dzięki regulowanej konstrukcji klosza.  Lampa EYE SUPER 6503 doskonale sprawdzi się we wnętrzach urządzonych w stylu industrialnym. Z uwagi na swój design - szczególnie polecany  do sypialni nad łóżko, bądź nad nowoczesną wyspę kuchenną. Wysokość całkowita wynosi 77 cm, zaś abażur ma wymiar 20 cm. Maksymalna moc przewidziana na jeden punkt świetlny to 35W. Stopień  ochrony IP20 sprawi, że może zostać zamontowana wewnątrz różnych pomieszczeń. Oprawa nie zawiera źródeł światła. Polecane żarówki dla lampy to GU10, które dostępne są w naszym sklepie.Produkt został wyprodukowany w Polsce. ZASTOSOWANIE:Produkt wykonany został z wysokiej jakości materiałów, zapewniających jego długotrwałą żywotność i satysfakcję z zakupu. Kupując u nas, otrzymujesz nowy, oryginalnie zapakowany produkt, objęty 2-letnią gwarancją producenta. Tylko zakup markowych produktów gwarantuje wysoką jakość, energooszczędność, bezpieczeństwo użytkowania oraz pewność, że informacje umieszczone na opakowaniach będą zgodne z prawdą.;https://leddo.pl/media/catalog/product/cache/07dd3f8478790f89e7d25033ddff57ef/6/5/6503_p3znowhk4etrhmmm.jpg
270;1;4;Lampa sufitowa czarno-złota MiLAGRO DALLAS + 1xGU10 3W LED ;155.00;1;10;Lampa sufitowa serii DALLAS GOLD, której producentem jest EkoLight marki MiLAGRO, to wyprodukowana z wysokiej jakości metalu z dbałością o każdy detal lampa. Lampa w stylu nowoczesnym przystosowana została do pracy z energooszczędnym źródłem świateł LED, gwintem GU10. W zestawie jest źródło światła o mocy 3W, które emituje światło o przyjemnej i ciepłej barwie (3000K) o strumieniu świetlnym 300lm.Lampy z kolekcji DALLAS to propozycja dla osób, które szukają do swojego domu rozwiązań nie tylko praktycznych, ale również stylowych. Prosta, geometryczna forma kloszy i elegancka kolorystyka, łącząca czerń i szlachetne złoto, sprawiają, że lampy – poza swoją podstawową funkcją oświetleniową – będą pełniły również rolę designerskiego dodatku. Szczególnie gdy zestawi się je z nowoczesnymi meblami z drewna i malowanego proszkowo metalu.MiLAGRO to marka, która produkuje swoje lampy m.in. na własnej linii produkcyjnej, w Polsce, przy użyciu specjalistycznych maszyn. Kupując lampy tej firmy, wspierasz polskie marki, przedsiębiorców i projektantów.Źródło światła w komplecie.ZASTOSOWANIE:Produkt wykonany został z wysokiej jakości materiałów, zapewniających jego długotrwałą żywotność i satysfakcję z zakupu. Kupując u nas, otrzymujesz nowy, oryginalnie zapakowany produkt, objęty 2-letnią gwarancją producenta. Tylko zakup markowych produktów gwarantuje wysoką jakość, energooszczędność, bezpieczeństwo użytkowania oraz pewność, że informacje umieszczone na opakowaniach będą zgodne z prawdą.;https://leddo.pl/media/catalog/product/cache/07dd3f8478790f89e7d25033ddff57ef/5/9/5902693765462-lampa-sufitowa-milagro_1__1.jpg
271;1;4;Lampa sufitowo-ścienna ruchoma regulowana 12,6W LED BERG 3 biały 3000K Polux;174.93;1;10;Czy chcesz urozmaicić i zachwycać swoim wnętrzem? Poznaj 13 najważniejszych zalet LAMPY SUFITOWO-ŚCIENNEJ!Lampa sufitowo-ścienna z trzema punktami świetlnymi w nowoczesnym stylu o mocy 12,6W i strumieniu świetlnym 1275lm, o ciepłej barwie światła, posiada szeroki kąt świecenia 120°. Jest w stanie oświetlić nawet najciemniejsze pomieszczenie i wprowadzić w nie przytulny, przyjemny i jasny klimat. TUBA będzie cieszącą oczy ozdobą, nadaje się także do przestrzeni komercyjnych, takich jak bar czy klimatyczna restauracja, jak również będzie doskonałym dodatkiem do nowoczesnych, glamour bądź tradycyjnych wnętrz, doda im uroku i sprawi, że odmienią one swoje oblicze.km.Ta lampa to produkt idealny dla każdego, kto pragnie udekorować swoje mieszkanie niepowtarzalnym i nieszablonowym dodatkiem, który będzie podkreślał oryginalny i awangardowy wystrój wnętrza.km.Niezwykle wygląda na tle jasnych ścian, lub w pomieszczeniu gdzie dominuje biel, ponieważ uwypukla to jej niezwykłą konstrukcję.POSTAW NA TĘ LAMPĘ SUFITOWO-ŚCIENNĄ I OCZARUJ SWOICH GOŚCI!  *MATERIAŁ WYKONANIA*ŁATWOŚĆ MONTAŻU*WYMIAR LAMPY GDZIE MOŻESZ WYKORZYSTAĆ LAMPĘ? Kilka przykładów zastosowań!  Wygląd Twojego mieszkania będzie UNIKATOWY, dzięki TEJ lampie! Produkt wykonany został z wysokiej jakości materiałów, zapewniających jego długotrwałą żywotność i satysfakcję z zakupu. Kupując u nas, otrzymujesz nowy, oryginalnie zapakowany produkt, objęty 2-letnią gwarancją producenta. Tylko zakup markowych produktów gwarantuje wysoką jakość, energooszczędność, bezpieczeństwo użytkowania oraz pewność, że informacje umieszczone na opakowaniach będą zgodne z prawdą.;https://leddo.pl/media/catalog/product/cache/07dd3f8478790f89e7d25033ddff57ef/5/9/5901508318138_1_kopia.jpg
272;1;4;Lampa sufitowo-ścienna ruchoma regulowana 12,6W LED BERG 3 czarny 3000K Polux;174.93;1;10;Czy chcesz urozmaicić i zachwycać swoim wnętrzem? Poznaj 13 najważniejszych zalet LAMPY sufitowo-ściennej!Lampa sufitowo-ścienna z trzema punktami świetlnymi w nowoczesnym stylu o mocy 12,6W i strumieniu świetlnym 1275lm, o ciepłej barwie światła, posiada szeroki kąt świecenia 120°. Jest w stanie oświetlić nawet najciemniejsze pomieszczenie i wprowadzić w nie przytulny, przyjemny i jasny klimat. TUBA będzie cieszącą oczy ozdobą, nadaje się także do przestrzeni komercyjnych, takich jak bar czy klimatyczna restauracja, jak również będzie doskonałym dodatkiem do nowoczesnych, glamour bądź tradycyjnych wnętrz, doda im uroku i sprawi, że odmienią one swoje oblicze.km.Ta lampa to produkt idealny dla każdego, kto pragnie udekorować swoje mieszkanie niepowtarzalnym i nieszablonowym dodatkiem, który będzie podkreślał oryginalny i awangardowy wystrój wnętrza.km.Niezwykle wygląda na tle jasnych ścian, lub w pomieszczeniu gdzie dominuje biel, ponieważ uwypukla to jej niezwykłą konstrukcję.POSTAW NA TĘ LAMPĘ SUFITOWO-ŚCIENNĄ I OCZARUJ SWOICH GOŚCI!  *MATERIAŁ WYKONANIA*ŁATWOŚĆ MONTAŻU*WYMIAR LAMPY GDZIE MOŻESZ WYKORZYSTAĆ LAMPĘ? Kilka przykładów zastosowań!  Wygląd Twojego mieszkania będzie UNIKATOWY, dzięki TEJ lampie! Produkt wykonany został z wysokiej jakości materiałów, zapewniających jego długotrwałą żywotność i satysfakcję z zakupu. Kupując u nas, otrzymujesz nowy, oryginalnie zapakowany produkt, objęty 2-letnią gwarancją producenta. Tylko zakup markowych produktów gwarantuje wysoką jakość, energooszczędność, bezpieczeństwo użytkowania oraz pewność, że informacje umieszczone na opakowaniach będą zgodne z prawdą.;https://leddo.pl/media/catalog/product/cache/07dd3f8478790f89e7d25033ddff57ef/5/9/5901508318176_1_kopia.jpg
273;1;4;Lampa sufitowo-ścienna ruchoma regulowana 12,6W LED RAWI 3 biały 3000K Polux;174.93;1;10;Czy chcesz urozmaicić i zachwycać swoim wnętrzem? Poznaj 13 najważniejszych zalet LAMPY SUFITOWO-ŚCIENNEJ!Lampa sufitowo-ścienna RAWI z trzema punktami świetlnymi w nowoczesnym stylu o mocy 12,6W i strumieniu świetlnym 1275lm, o ciepłej barwie światła, posiada szeroki kąt świecenia 120°. Jest w stanie oświetlić nawet najciemniejsze pomieszczenie i wprowadzić w nie przytulny, przyjemny i jasny klimat. TUBA będzie cieszącą oczy ozdobą, nadaje się także do przestrzeni komercyjnych, takich jak bar czy klimatyczna restauracja, jak również będzie doskonałym dodatkiem do nowoczesnych, glamour bądź tradycyjnych wnętrz, doda im uroku i sprawi, że odmienią one swoje oblicze.km.Ta lampa to produkt idealny dla każdego, kto pragnie udekorować swoje mieszkanie niepowtarzalnym i nieszablonowym dodatkiem, który będzie podkreślał oryginalny i awangardowy wystrój wnętrza.km.Niezwykle wygląda na tle jasnych ścian, lub w pomieszczeniu gdzie dominuje biel, ponieważ uwypukla to jej niezwykłą konstrukcję.POSTAW NA TĘ LAMPĘ SUFITOWO-ŚCIENNĄ I OCZARUJ SWOICH GOŚCI!*MATERIAŁ WYKONANIA*ŁATWOŚĆ MONTAŻU*WYMIAR LAMPY GDZIE MOŻESZ WYKORZYSTAĆ LAMPĘ? Kilka przykładów zastosowań!  Wygląd Twojego mieszkania będzie UNIKATOWY, dzięki TEJ lampie! Produkt wykonany został z wysokiej jakości materiałów, zapewniających jego długotrwałą żywotność i satysfakcję z zakupu. Kupując u nas, otrzymujesz nowy, oryginalnie zapakowany produkt, objęty 2-letnią gwarancją producenta. Tylko zakup markowych produktów gwarantuje wysoką jakość, energooszczędność, bezpieczeństwo użytkowania oraz pewność, że informacje umieszczone na opakowaniach będą zgodne z prawdą.;https://leddo.pl/media/catalog/product/cache/07dd3f8478790f89e7d25033ddff57ef/5/9/5901508318329_rawi_3.jpg
274;1;4;Lampa sufitowa Isabell 3x E27 Metal i szkło Lampex styl nowoczesny glamour;183.00;1;10;Isabell to lampa sufitowa, która jest świetną propozycją dla miłośników stylu glamour i nowoczesnego. Nowoczesna lampa za sprawą dekoracyjnych mlecznych kloszy oraz łańcuszka z kryształkami będzie pięknym elementem dekoracyjnym w niemalże każdym pomieszczeniu. Korpus lampy sufitowej przywodzi na myśl pętlę, która przykuwa uwagę i nie sposób przejść obok niej obojętnie. Lampa glamour wykonana z najwyższej jakości metalu i szkła  pozwoli cieszyć się trwałością oraz niezawodnością przez wiele lat. Lampa współpracuje z trzema żarówkami o trzonku E27 o mocy maksymalnej wynoszącej 60W, wraz z którymi pięknie oświetli każde pomieszczenie.;https://leddo.pl/media/catalog/product/cache/07dd3f8478790f89e7d25033ddff57ef/8/1/814_3814_3_eaw1vtopt7wjlw4y.jpg
