"ID";"Enabled";"Category";"Name";"Price";"Tax rule ID";"Quantity";"Long desc";"Images URL"
370;1;5;Lampa ścienna kinkiet K-8111 z serii DEFIS 1xE14 Kaja;85.01;1;10;Odmień swoje wnętrze dzięki kinkietom DEFISPoznaj ich największe zalety!Kinkiet DEFIS wykonany został z wysokiej jakości szkła i metalu. Dzięki zastosowaniu materiałów najwyższej jakości zachowuje doskonały wygląd przez wiele lat. Decydując się na te kinkiety, warto postawić na dekoracyjne żarówki typu filament. Wspaniale prezentuje się we wnętrzach nowoczesnych, gdzie pojawiają się detale w kolorze czarnym. Można z powodzeniem wykorzystać go również w pomieszczeniach urządzonych w stylu loft, czy boho, będzie pasować również do bardziej klasycznych aranżacji.   Sprawdzi się jako dodatkowe źródło światła nie tylko w salonie, ale także w sypialni czy jadalni. Można go wykorzystać również w korytarzu czy jako oświetlenie schodów.DODAJ SWOIM WNĘTRZOM CHARAKTERU DZIĘKI KINKIETOM SAMANTA  MATERIAŁ WYKONANIAPrezentowany kinkiet wyprodukowany jest z wysokiej jakości szkła i metalu. Powstał z dużą dbałością o szczegóły, dzięki czemu wygląda bardzo elegancko i wygląda doskonale, nawet po wielu latach użytkowania.  GWINT E14Lampa współpracuje ze źródłem światła o trzonku E14 o maksymalnej mocy 25W. Do prezentowanego kinkietu z łatwością dobierzemy zatem energooszczędną żarówkę LED, która po zamontowaniu pozwoli cieszyć się pięknie oświetlonym pomieszczeniem przy niskim zużyciu energii. UWAGA! Brak źródła światła w komplecie. EFEKTOWNA OPRAWAOprawa kinkietu DEFIS o kulistym kształcie wykonana jest z przydymionego szkła. Dzięki temu jest interesującym dodatkiem do aranżacji danego wnętrza w dzień, a wieczorem daje piękny efekt rozproszenia światła.       ŁATWOŚĆ MONTAŻUKinkiet jest dosyć lekki. Jego montaż jest zatem bardzo łatwy. Zestaw zawiera akcesoria niezbędna od przymocowania lampy.   WYMIAR LAMPYWysokość całkowita lampy wynosi 13 cm. Całkowita szerokość lampy to 9 cm.    GDZIE MOŻESZ WYKORZYSTAĆ LAMPĘ?Kilka przykładów zastosowań!  Prezentowana lampa doskonale wygląda się w połączeniu z innymi elementami oświetlenia w podobnym stylu. Z ich wykorzystaniem łatwo stworzysz stylową aranżację oświetlenia w całym domu. Wygląd Twojego mieszkania będzie UNIKATOWY, dzięki TEJ lampie! Produkt wykonany został z wysokiej jakości materiałów, zapewniających jego długotrwałą żywotność i satysfakcję z zakupu. Kupując u nas, otrzymujesz nowy, oryginalnie zapakowany produkt, objęty 2-letnią gwarancją producenta. Tylko zakup markowych produktów gwarantuje wysoką jakość, energooszczędność, bezpieczeństwo użytkowania oraz pewność, że informacje umieszczone na opakowaniach będą zgodne z prawdą.;https://leddo.pl/media/catalog/product/cache/07dd3f8478790f89e7d25033ddff57ef/k/i/kinkiet_defis_5901425516006.jpg
371;1;5;Kinkiet lampa ścienna czarna MiLAGRO KANE 1x E27 ;95.01;1;10;Lampa wisząca serii KANE BLACK, której producentem jest Eko-Light marki MiLAGRO, to wyprodukowana z wysokiej jakości metalu lampa. Czarno-złoty kinkiet został wykonany z dbałością o każdy detal. Ażurowe żyrandole zostały zaprojektowane w taki sposób, aby wyeksponować dekoracyjną żarówkę. Metalowy i druciany klosz o geometrycznym kształcie przyciąga wzrok i nadaje pomieszczeniom niepowtarzalny charakter. Lampa ścienna współpracuje z żarówkami o trzonku E27 o mocy nieprzekraczającej 60W. Lampa w industrialnym stylu będzie doskonałym dodatkiem do nowoczesnych bądź minimalistycznych wnętrz i sprawi, że odmienią one swoje oblicze.MiLAGRO to marka, która produkuje swoje lampy m.in. na własnej linii produkcyjnej, w Polsce, przy użyciu specjalistycznych maszyn. Kupując lampy tej firmy, wspierasz polskie marki, przedsiębiorców i projektantów.ZASTOSOWANIE:Produkt wykonany został z wysokiej jakości materiałów, zapewniających jego długotrwałą żywotność i satysfakcję z zakupu. Kupując u nas, otrzymujesz nowy, oryginalnie zapakowany produkt, objęty 2-letnią gwarancją producenta. Tylko zakup markowych produktów gwarantuje wysoką jakość, energooszczędność, bezpieczeństwo użytkowania oraz pewność, że informacje umieszczone na opakowaniach będą zgodne z prawdą.;https://leddo.pl/media/catalog/product/cache/07dd3f8478790f89e7d25033ddff57ef/5/9/5902693747932-kinkiet-kane-czarny-leddo_1_.jpg
372;1;5;Kinkiet lampa ścienna Quado PRO PLUS A biały 1xG9 Metal styl nowoczesny Lampex;109.00;1;10;Quado to nowoczesna lampa ścienna o przykuwającym uwagę geometrycznym kształcie. Lampa idealnie wkomponuje się w pomieszczenia takie jak przedpokój, salon czy jadalnia, nadając im przy tym niepowtarzalny klimat. Geometryczna lampa pięknie prezentuje się na ścianie i przyciąga wzrok. Do jej produkcji wykorzystano wyłącznie materiały najwyższej jakości, dzięki czemu prezentuje się wspaniale, jednocześnie będąc niezwykle wytrzymałą i odporną na uszkodzenia. Kinkiet współgra z żarówkami o trzonku G9 oraz mocy max 40W (brak w zestawie).;https://leddo.pl/media/catalog/product/cache/07dd3f8478790f89e7d25033ddff57ef/6/9/690_ka-bia690_ka-bia_hyeeaqojjefsc8us.jpg
373;1;5;Kinkiet Lampa Ścienna FABRIZIA E14 Biała 36cm - Polux;109.45;1;10;SZUKASZ STYLOWEGO I NASTROJOWEGO OŚWIETLENIA DO SWOJEJ SYPIALNI LUB SALONU? POSTAW NA KINKIETY Z SERII FABRIZIA! Białe kinkiety FABRIZIA idealnie sprawdzą się nie tylko w sypialni, ale również w salonie. To efektywne i niezwykle stylowe dodatkowe dekoracyjne źródło światła. Wyglądają bardzo dekoracyjnie i pozwalają stworzyć kameralną atmosferę w danym pomieszczeniu, która będzie sprzyjała chwilom spędzanym we dwoje lub wieczornemu relaksowi z książką czy telewizją. Sprawdzi się zarówno we wnętrzach nowoczesnych, klasycznych, jak i minimalistycznych. Może być także ciekawym przełamaniem wnętrza w stylu loftowym. Będzie pasować również do aranżacji inspirowanych stylem retro. Tworzy interesujące połączenie z cegłą, batonem, a także klasycznie wykończonymi ścianami.  ODMIEŃ SWOJĄ SYPIALNIĘ DZIĘKI KINKIETOM Z SERII VEJLE!    *WYSOKA JAKOŚĆ *WSPÓŁPRACA Z ŻARÓWKAMI NA GWINT E14 *EFEKTOWNA OPRAWA    *WYMIAR LAMPY *MONTAŻ  GDZIE MOŻESZ WYKORZYSTAĆ LAMPĘ?   Prezentowana lampa doskonale prezentuje się w połączeniu z innymi elementami oświetlenia z serii FABRIZIA. Z ich wykorzystaniem łatwo stworzysz stylową aranżację oświetlenia w całym domu.  Wygląd Twojego mieszkania będzie UNIKATOWY, dzięki TEJ lampie!Produkt wykonany został z wysokiej jakości materiałów, zapewniających jego długotrwałą żywotność i satysfakcję z zakupu. Kupując u nas, otrzymujesz nowy, oryginalnie zapakowany produkt, objęty 2-letnią gwarancją producenta. Tylko zakup markowych produktów gwarantuje wysoką jakość, energooszczędność, bezpieczeństwo użytkowania oraz pewność, że informacje umieszczone na opakowaniach będą zgodne z prawdą.;https://leddo.pl/media/catalog/product/cache/07dd3f8478790f89e7d25033ddff57ef/l/a/lampa-scienna-kinkiet-fabrizia-e14-sanico-polux-leddopl.jpg
374;1;5;Kinkiet JOKER BIAŁY DREWNO lampa sufitowa ścienna 1xGU10 MILAGRO Metal styl nowoczesny;110.00;1;10;Kinkiet, w kolorze biało-drewnianym, pochodzący z wyjątkowej kolekcji JOKER WHITE/WOOD jest niezwykle eleganckim produktem, który łączy w sobie minimalistyczny szyk i nowoczesność. Dzięki swojemu uniwersalnemu zastosowaniu lampa ta może służyć zarówno jako lampa ścienna jak i lampa sufitowa. Biała oprawa subtelnie łącząca się ze złotym i delikatnym zakończeniem prezentuje się niezwykle elegancko i jest piękną ozdobą każdego wnętrza. Producentem tej lampy jest polska marka MiLAGRO. Lampa ścienna została wykonana z dbałością o najmniejszy detal, dzięki czemu wprowadza we wnętrza odrobinę luksusu. Biała lampa współpracuje z żarówką o trzonku GU10, o mocy maksymalnej 8W. Wraz z tą elegancką lampą każde mieszkanie nabierze wyjątkowego, ekskluzywnego i nowoczesnego wyrazu, a widok kilku lamp z tej kolekcji, zamontowanych koło siebie, z pewnością zachwyci każdego.MiLAGRO to marka, która produkuje swoje lampy m.in. na własnej linii produkcyjnej, w Polsce, przy użyciu specjalistycznych maszyn. Kupując lampy tej firmy wspierasz polskie marki, przedsiębiorców i projektantów. Ponadto kolekcja JOKER objęta jest gwarancją producenta. Czas jej trwania wynosi 24 miesiące. W tym okresie wszelkie naprawy są świadczone nieodpłatnie.;https://leddo.pl/media/catalog/product/cache/07dd3f8478790f89e7d25033ddff57ef/5/9/5902693762997-001.jpg
375;1;5;Nowoczesna lampa ścienna czarna kinkiet do sypialni 1 x E27  ;110.00;1;10;  Nowoczesna lampa ścienna w kolorze czarnym została zaprojektowana z myślą o oświetleniu sypialni. Posiada ona gniazdo na żarówkę LED o trzonku E27. Żarówka wkręcona do lampy ściennej będzie się pięknie prezentować między czarnymi elementami lampy, a po zaświeceniu stworzy ona interesującą i przytulną atmosferę. Kinkiet stworzony w zgodzie z najnowszymi trendami projektowania wnętrz został dopracowany w najmniejszych szczegółach. Zachwyca w nim minimalistyczne piękno. Jest on idealny do sypialni, choć sprawdzi się również w salonie czy jadalni jako oświetlenie dodatkowe.	Ta lampa ścienna nada nowy, wyjątkowy charakter każdemu wnętrzu. Kinkiet wykonany z wysokiej jakości materiałów jest inwestycją na długi czas. Produkt wykonany został z wysokiej jakości materiałów, zapewniających jego długotrwałą żywotność i satysfakcję z zakupu. Kupując u nas otrzymujesz nowy, oryginalnie zapakowany produkt, objęty 2-letnią gwarancją producenta. Tylko zakup markowych produktów gwarantuje wysoką jakość, energooszczędność, bezpieczeństwo użytkowania oraz pewność, że informacje umieszczone na opakowaniach będą zgodne z prawdą.;https://leddo.pl/media/catalog/product/cache/07dd3f8478790f89e7d25033ddff57ef/l/a/lampa-scienna-kinkiet-do-sypialni-1x-e27-nowoczesna-czarna-001.jpg
376;1;5;Kinkiet Kris Biały 1xG9 Modern Gips Lampex;113.00;1;10;Kinkiet Kris to nowoczesna lampa ścienna o prostym a zarazem ciekawym geometrycznym kształcie. Jednolity, stonowany kolor oprawy pozwoli wkomponować ją w wystrój każdego wnętrza, Kinkiet po zapaleniu rzuca poświatę, która doskonale podkreśli ciekawy obraz, lub lustro.  Lampa współgra z żarówkami o trzonku G9 oraz  mocy max 40W (brak w zestawie).;https://leddo.pl/media/catalog/product/cache/07dd3f8478790f89e7d25033ddff57ef/7/0/701_1-bia701_1-bia_9a7z9xn3xgxelhmj.jpg
377;1;5;Kinkiet Diego biały 1xG9 Metal styl nowoczesny Lampex;116.00;1;10;Diego to nowoczesna lampa ścienna o wspaniałym obłym kształcie. Kinkiet idealnie wkomponuje się w pomieszczenia takie jak przedpokój, salon, czy jadalnia. Wyjątkowa poświata rzucana przez lampę idealnie podkreśli wyjątkowy obraz lub lustro. Do jego produkcji wykorzystano wyłącznie materiały najwyższej jakości, dzięki czemu prezentuje się wspaniale, jednocześnie będąc niezwykle wytrzymałym i odpornym na uszkodzenia.  Tuba współgra z żarówkami o trzonku G9 oraz mocy max 40W (brak w zestawie).;https://leddo.pl/media/catalog/product/cache/07dd3f8478790f89e7d25033ddff57ef/7/5/752_k-bia752_k-bia_6dqn2az7gdldeext.jpg
378;1;5;Oprawa lampa ścienna natynkowa biała KINKIET ASIL G9 Kanlux ;117.62;1;10;Lampa ścienna Kinkiet ASIL w kolorze białym, to charakterystyczny styl zachowany w kształcie, szerokim wyborze palety kolorów oraz dbałość o każdy szczegół wykonania. Lampa przystosowana została do pracy z energooszczędnymi źródłami świateł LED z gwintem G9 i mocy nieprzekraczającej 40W. Produkt wykonany został z wysokogatunkowego stopu aluminium. Kanlux ASIL to kinkiety, które dzięki swojemu kształtowi tworzą bardzo ciekawy efekt świetlny na ścianie. Światło rozchodzi się nie tylko do góry i na dół, ale również wydobywa się przez specjalnie zaprojektowaną szczelinę. Dzięki oprawie Kanlux ASIL stworzymy przytulny nastrój w domu, wnętrzu hotelowym lub uzupełnimy oświetlenie w restauracji czy kawiarni.Brak źródła światła w komplecie.-> KOD PRODUKTU: 27022 Produkt wykonany został z wysokiej jakości materiałów, zapewniających jego długotrwałą żywotność i satysfakcję z zakupu. Kupując u nas, otrzymujesz nowy, oryginalnie zapakowany produkt, objęty 2-letnią gwarancją producenta. Tylko zakup markowych produktów gwarantuje wysoką jakość, energooszczędność, bezpieczeństwo użytkowania oraz pewność, że informacje umieszczone na opakowaniach będą zgodne z prawdą.;https://leddo.pl/media/catalog/product/cache/07dd3f8478790f89e7d25033ddff57ef/5/9/5905339270221-kinkiet-asil-kanlux_1_.jpg
379;1;5;Oprawa lampa ścienna natynkowa szara KINKIET ASIL G9 Kanlux ;117.62;1;10;Lampa ścienna Kinkiet ASIL w kolorze szarym, to charakterystyczny styl zachowany w kształcie, szerokim wyborze palety kolorów oraz dbałość o każdy szczegół wykonania. Lampa przystosowana została do pracy z energooszczędnymi źródłami świateł LED z gwintem G9 i mocy nieprzekraczającej 40W. Produkt wykonany został z wysokogatunkowego stopu aluminium. Kanlux ASIL to kinkiety, które dzięki swojemu kształtowi tworzą bardzo ciekawy efekt świetlny na ścianie. Światło rozchodzi się nie tylko do góry i na dół, ale również wydobywa się przez specjalnie zaprojektowaną szczelinę. Dzięki oprawie Kanlux ASIL stworzymy przytulny nastrój w domu, wnętrzu hotelowym lub uzupełnimy oświetlenie w restauracji czy kawiarni.Brak źródła światła w komplecie.-> KOD PRODUKTU: 27021 Produkt wykonany został z wysokiej jakości materiałów, zapewniających jego długotrwałą żywotność i satysfakcję z zakupu. Kupując u nas, otrzymujesz nowy, oryginalnie zapakowany produkt, objęty 2-letnią gwarancją producenta. Tylko zakup markowych produktów gwarantuje wysoką jakość, energooszczędność, bezpieczeństwo użytkowania oraz pewność, że informacje umieszczone na opakowaniach będą zgodne z prawdą.;https://leddo.pl/media/catalog/product/cache/07dd3f8478790f89e7d25033ddff57ef/5/9/5905339270214-oprawa-kinkiet-asil-kanlux_1_.jpg
380;1;5;Klasyczna lampa ścienna złota beżowa kinkiet do salonu abażur z tkaniny 1 x E27;120.00;1;10;  	Lampa ścienna o klasycznym wyglądzie to elegancki i luksusowy dodatek do każdego wnętrza. Jest ona przystosowana do pracy z żarówką o trzonku E27. Kinkiet charakteryzuje się pięknym wyglądem. Zaletą tej klasycznej lampy jest ekskluzywny materiałowy abażur o ciekawym wzorze. Dzięki niemu źródło światła przymocowane do kinkietu będzie emitować piękne, rozproszone światło. Lampa idealnie nadaje się do salonu, sypialni czy pokoju gościnnego jako światło dodatkowe. 	Lampa ścienna została wykonana z materiałów wysokiej jakości i z niezwykłą dbałością o szczegóły. Jest to dobry zakup, który będzie cieszył oczy swoim pięknym wyglądem przez długi czas.Produkt wykonany został z wysokiej jakości materiałów, zapewniających jego długotrwałą żywotność i satysfakcję z zakupu. Kupując u nas otrzymujesz nowy, oryginalnie zapakowany produkt, objęty 2-letnią gwarancją producenta. Tylko zakup markowych produktów gwarantuje wysoką jakość, energooszczędność, bezpieczeństwo użytkowania oraz pewność, że informacje umieszczone na opakowaniach będą zgodne z prawdą.;https://leddo.pl/media/catalog/product/cache/07dd3f8478790f89e7d25033ddff57ef/l/a/lampa-scienna-kinkiet-klasyczny-luksusowy-zloty-001.jpg
381;1;5;Klasyczna lampa ścienna nocna srebrna kinkiet do salonu sypialni abażur z tkaniny 1 x E27;120.00;1;10;	Lampa ścienna z abażurem o pięknym wzorze to wykonana w zgodzie z najnowszymi standardami lampa, przeznaczona na żarówkę LED o trzonku E27. Lampa ścienna została zaprojektowana z myślą o oświetleniu sypialni. Kinkiet z kloszem wykonanym z eleganckiej tkaniny nada romantycznej aury każdemu wnętrzu. Urocza lampa na ścianę idealnie sprawdzi się w salonie lub sypialni jako oświetlenie dodatkowe. Srebrne elementy lampy nadadzą wnętrzu elegancji, a klosze zrobione z dbałością o detale wprowadzą przytulną atmosferę. Ponadto lampka ta zamontowana w sypialni może służyć jako lampka nocna	Z tą lampą każde pomieszczenie nabierze szczególnego charakteru. Z pewnością sypialnia w której zamontuje się ten kinkiet będzie bardziej przytulna, a przyjemne światło wydobywające się z żarówki wprowadzi czarujący nastrój i ciekawy efekt świetlny. Produkt wykonany został z wysokiej jakości materiałów, zapewniających jego długotrwałą żywotność i satysfakcję z zakupu. Kupując u nas otrzymujesz nowy, oryginalnie zapakowany produkt, objęty 2-letnią gwarancją producenta. Tylko zakup markowych produktów gwarantuje wysoką jakość, energooszczędność, bezpieczeństwo użytkowania oraz pewność, że informacje umieszczone na opakowaniach będą zgodne z prawdą.;https://leddo.pl/media/catalog/product/cache/07dd3f8478790f89e7d25033ddff57ef/k/i/kinkiet-lampa-scienna-1x-e27-klasyczna-biala-srebrna-001.jpg
382;1;5;Kinkiet Harold Biały 1xE14 Modern Gips Lampex;122.00;1;10;Harold to nowoczesny kinkiet utrzymany w minimalistycznym stylu. Podłużny kształt kinkietu wraz z symetrycznie umieszczonymi wcięciami nadaje lampie prosty, a zarazem przyciągający uwagę wygląd. Jednolity, stonowany kolor oprawy pozwoli wkomponować ją w wystrój każdego wnętrza. Kinkiet po zapaleniu rzuca poświatę, która doskonale podkreśli ciekawy obraz, lub lustro.  Gipsowa lampa współgra z żarówkami o trzonku E14 oraz mocy max 60W (brak w zestawie).;https://leddo.pl/media/catalog/product/cache/07dd3f8478790f89e7d25033ddff57ef/6/9/697_1-bia697_1-bia_waskx9ge3uiiuesp.jpg
383;1;5;Kinkiet BEAM LED lampa ścienna obrazowa 6W 420lm 3000K ciepła MiLAGRO ;135.00;1;10;Kinkiet ścienny obrazowy z pełni wymienialnym jednym punktem światła LED serii BEAM, której producentem jest Eko-Light marki MiLAGRO, to wyprodukowana z wysokiej jakości metalu i akrylu lampa. Jest to połączenie klasyki i oryginalności, wyróżnia ją prostota i funkcjonalność. Dużą zaletą kinkietu jest możliwość regulacji położenia elementu świetlnego, a także kąta nachylenia względem oświetlanej płaszczyzny, przez co konstrukcja "klosza" ujmująco rozprasza światło, tworząc charakterystyczny, niepowtarzalny efekt światłocienia.Lampa, posiada ledowe źródło światła, które świeci barwą przyjazną dla oka ludzkiego 3000K o strumieniu świetlnym równym 420lm, jest przy tym energooszczędne 6W co odpowiada 36W w żarówkach żarowych. Szerokość kinkietu to 31 cm, z kolei puszki montażowej 25 cm. Odległość od ściany wynosi maksymalnie do 18 cm.Kinkiet jest doskonałą propozycją nie tylko do nowoczesnych i stylowych salonów. Swoje miejsce znajdzie też w sypialni, przedpokoju, a nawet kuchni. Za jego pomocą oświetlimy obrazy oraz ramki. Lampa może z powodzeniem zostać wykorzystana jako oświetlenie, np. lustra. Wykorzystanie tej lampy zrobi imponujące wrażenie, którego każdy pozazdrości. MiLAGRO to marka, która produkuje swoje lampy m.in. na własnej linii produkcyjnej, w Polsce, przy użyciu specjalistycznych maszyn. Kupując lampy tej firmy, wspierasz polskie marki, przedsiębiorców i projektantów.Brak źródła światła w komplecie.ZASTOSOWANIE:Produkt wykonany został z wysokiej jakości materiałów, zapewniających jego długotrwałą żywotność i satysfakcję z zakupu. Kupując u nas, otrzymujesz nowy, oryginalnie zapakowany produkt, objęty 2-letnią gwarancją producenta. Tylko zakup markowych produktów gwarantuje wysoką jakość, energooszczędność, bezpieczeństwo użytkowania oraz pewność, że informacje umieszczone na opakowaniach będą zgodne z prawdą.;https://leddo.pl/media/catalog/product/cache/07dd3f8478790f89e7d25033ddff57ef/5/9/5907377243021-kinkiet-scienny-obrazowy.jpg
384;1;5;Kinkiet Vitrum B czarny loft 1xG9 Metal i szkło Lampex;135.00;1;10;Vitrum to nowoczesna lampa ścienna o wspaniałym geometrycznym kształcie. Kinkiet idealnie wkomponuje się w pomieszczenia takie jak przedpokój, salon, czy jadalnia, a tafla ozdobnego szkła dodatkowo podkreśli wystrój wnętrza. Geometryczna lampa współgra z żarówkami o trzonku G9 oraz mocy max 40W (brak w zestawie).;https://leddo.pl/media/catalog/product/cache/07dd3f8478790f89e7d25033ddff57ef/7/2/726_b-cza726_b-cza_d2i1xg14hegjlcnh.jpg
385;1;5;Kinkiet Peter 2xG9 Gips Biały Modern  Lampex;140.00;1;10;Kinkiet Peter to nowoczesna lampa ścienna o nieskomplikowanym a zarazem ciekawym geometrycznym kształcie. Jednolity, stonowany kolor oprawy pozwoli wkomponować ją w wystrój każdego wnętrza. Kinkiet po zapaleniu rzuca poświatę, która doskonale podkreśli ciekawy obraz, lub lustro. Lampa została wykonana z wysokiej jakości gipsu, dzięki czemu wspaniale się prezentuje, zachowując przy tym walory niezawodności. Lampa jest kompatybilna z żarówkami G9 o mocy 40W (brak w zestawie).;https://leddo.pl/media/catalog/product/cache/07dd3f8478790f89e7d25033ddff57ef/7/1/711_1-bia711_1-bia_3wiotjvnaysw3jqh.jpg
386;1;5;Kinkiet w stylu skandynawskim lampa ścienna MiLAGRO DAMA 1x E27 Drewno + metal;145.00;1;10;Lampa ścienna kinkiet serii DAMA BLACK, której producentem jest EkoLight marki MiLAGRO, to wyprodukowana z wysokiej jakości metalu i drewna z dbałością o każdy detal lampa. Lampa w stylu skandynawskim przystosowana została do pracy z energooszczędnym źródłem świateł LED, gwintem E27. Czarny klosz z drewnianym dodatkiem doskonale się ze sobą komponują i są idealną ozdobą każdego pomieszczenia.Wykorzystanie tej lampy będzie doskonałym dodatkiem do nowoczesnych bądź minimalistycznych wnętrz, które robi imponujące wrażenie, którego każdy pozazdrości. Lampa prezentuję się świeżo, przyciąga wzrok i stanowi stylowy dodatek dla efektownych wnętrz.MiLAGRO to marka, która produkuje swoje lampy m.in. na własnej linii produkcyjnej, w Polsce, przy użyciu specjalistycznych maszyn. Kupując lampy tej firmy, wspierasz polskie marki, przedsiębiorców i projektantów.Brak źródła światła w komplecie.ZASTOSOWANIE:Produkt wykonany został z wysokiej jakości materiałów, zapewniających jego długotrwałą żywotność i satysfakcję z zakupu. Kupując u nas, otrzymujesz nowy, oryginalnie zapakowany produkt, objęty 2-letnią gwarancją producenta. Tylko zakup markowych produktów gwarantuje wysoką jakość, energooszczędność, bezpieczeństwo użytkowania oraz pewność, że informacje umieszczone na opakowaniach będą zgodne z prawdą.;https://leddo.pl/media/catalog/product/cache/07dd3f8478790f89e7d25033ddff57ef/e/k/ekolig3474_1_.jpg
